{
  "task_id": "CHAT-20261005-0143-NEXY-COMMITMENT-INTEGRITY-KERNEL",
  "objective": "Design, implement, test, and document a novel AI-proposed NEXY-compatible commitment integrity reference system in AI-CONTEXT only.",
  "target": "คลังข้อมูลเสริม/CHAT-20261005-0143-NEXY-COMMITMENT-INTEGRITY-KERNEL",
  "repository": "goif74945-crypto/AI-CONTEXT",
  "branch": "main",
  "expected_head": "6607c3bbff3a35f0d7a386032d46d7b63722258e",
  "authorized_scope": [
    "คลังข้อมูลเสริม/CHAT-20261005-0143-NEXY-COMMITMENT-INTEGRITY-KERNEL/**"
  ],
  "protected_scope": [
    "any repository whose name contains NEXY.AI",
    "all existing paths outside คลังข้อมูลเสริม/CHAT-20261005-0143-NEXY-COMMITMENT-INTEGRITY-KERNEL/",
    "canonical NEXY build requirements"
  ],
  "authority_sources": [
    "current user directive",
    "AI-CONTEXT/AI-EXECUTION-KERNEL.md",
    "AI-CONTEXT/rules/SECURITY.md",
    "AI-CONTEXT/rules/VERIFICATION.md",
    "AI-CONTEXT/projects/NEXY.AI/overview.md"
  ],
  "preconditions": [
    "AI-CONTEXT is writable",
    "supplemental folder exists",
    "new project path is unique",
    "NEXY.AI repo remains untouched"
  ],
  "success_invariants": [
    "All new artifacts remain inside the authorized supplemental folder.",
    "Every future/persistent commitment requires a compatible execution capability.",
    "Commitment completion cannot be emitted without evidence satisfying the declared evidence requirement.",
    "Equivalent normalized inputs produce identical decisions.",
    "Unknown or conflicting authority fails closed.",
    "No claim is made that the reference implementation is canonical NEXY production code."
  ],
  "forbidden_actions": [
    "Modify any repository whose name contains NEXY.AI.",
    "Modify existing AI-CONTEXT files outside the new project folder.",
    "Claim E3+ integration/runtime/deployment evidence without execution.",
    "Invent a platform chat ID.",
    "Use hidden model reasoning as authority."
  ],
  "required_evidence": [
    "E0_PRESENCE",
    "E1_STATIC",
    "E2_UNIT"
  ],
  "stop_conditions": [
    "A required mutation would leave the authorized folder.",
    "The selected concept is found to duplicate an existing project materially.",
    "Tests reveal an unresolved critical invariant violation.",
    "Repository permissions or state prevent safe write-back."
  ],
  "deliverables": [
    "session memory",
    "task contract",
    "architecture",
    "requirements",
    "failure model",
    "reference code",
    "schemas",
    "fixtures",
    "tests",
    "validation report",
    "integration proposal",
    "future ideas",
    "final audit"
  ]
}
